{
  "schema_version": "ao.sentinel.security-review.v0.1",
  "status": "clear",
  "review_id": "security-ao-forge-goal-verification",
  "target_id": "local-ao-stack",
  "repository": "ao-forge",
  "severity": "info",
  "scopes_checked": [
    "secrets",
    "input_validation",
    "authorization",
    "dependencies",
    "logging",
    "public_artifacts"
  ],
  "evidence": [
    "docs/contracts/goal-run-verification-v0.1.schema.json",
    "examples/goals/ao2-weekend-hardening.goal-run-verification.json"
  ],
  "findings": [],
  "recommended_actions": [],
  "promoter_hold_required": false,
  "mutates_live_state": false,
  "generated_at_utc": "2026-06-26T12:01:00Z",
  "observed_request_at_utc": "2026-06-26T12:00:00Z"
}
